{
  "id": "california",
  "name": "California (RELM testing region)",
  "polygon": [
    [
      -125.4,
      40.1
    ],
    [
      -125.4,
      41.1
    ],
    [
      -125.3,
      41.1
    ],
    [
      -125.3,
      42.4
    ],
    [
      -125.2,
      42.4
    ],
    [
      -125.2,
      43.0
    ],
    [
      -119.0,
      43.0
    ],
    [
      -119.0,
      39.4
    ],
    [
      -118.8,
      39.3
    ],
    [
      -118.8,
      39.2
    ],
    [
      -118.7,
      39.2
    ],
    [
      -118.7,
      39.1
    ],
    [
      -118.5,
      39.1
    ],
    [
      -118.5,
      39.0
    ],
    [
      -118.3,
      38.9
    ],
    [
      -118.3,
      38.8
    ],
    [
      -118.1,
      38.8
    ],
    [
      -118.1,
      38.7
    ],
    [
      -117.9,
      38.6
    ],
    [
      -117.9,
      38.5
    ],
    [
      -117.7,
      38.5
    ],
    [
      -117.6,
      38.3
    ],
    [
      -117.4,
      38.3
    ],
    [
      -117.4,
      38.2
    ],
    [
      -117.3,
      38.2
    ],
    [
      -117.2,
      38.0
    ],
    [
      -117.0,
      38.0
    ],
    [
      -117.0,
      37.9
    ],
    [
      -116.8,
      37.8
    ],
    [
      -116.8,
      37.7
    ],
    [
      -116.6,
      37.7
    ],
    [
      -116.6,
      37.6
    ],
    [
      -116.4,
      37.5
    ],
    [
      -116.4,
      37.4
    ],
    [
      -116.2,
      37.4
    ],
    [
      -116.2,
      37.3
    ],
    [
      -116.0,
      37.2
    ],
    [
      -116.0,
      37.1
    ],
    [
      -115.8,
      37.1
    ],
    [
      -115.8,
      37.0
    ],
    [
      -115.6,
      36.9
    ],
    [
      -115.6,
      36.8
    ],
    [
      -115.4,
      36.8
    ],
    [
      -115.3,
      36.6
    ],
    [
      -115.1,
      36.6
    ],
    [
      -115.1,
      36.5
    ],
    [
      -115.0,
      36.5
    ],
    [
      -114.9,
      36.3
    ],
    [
      -114.7,
      36.3
    ],
    [
      -114.7,
      36.2
    ],
    [
      -114.6,
      36.2
    ],
    [
      -114.5,
      36.0
    ],
    [
      -114.3,
      36.0
    ],
    [
      -114.2,
      35.8
    ],
    [
      -114.1,
      35.8
    ],
    [
      -114.1,
      35.7
    ],
    [
      -113.9,
      35.6
    ],
    [
      -113.9,
      35.5
    ],
    [
      -113.8,
      35.5
    ],
    [
      -113.8,
      35.3
    ],
    [
      -113.6,
      35.2
    ],
    [
      -113.5,
      34.8
    ],
    [
      -113.3,
      34.7
    ],
    [
      -113.3,
      34.5
    ],
    [
      -113.1,
      34.4
    ],
    [
      -113.1,
      34.1
    ],
    [
      -113.2,
      34.1
    ],
    [
      -113.2,
      33.8
    ],
    [
      -113.3,
      33.8
    ],
    [
      -113.3,
      33.4
    ],
    [
      -113.4,
      33.4
    ],
    [
      -113.4,
      33.1
    ],
    [
      -113.5,
      33.1
    ],
    [
      -113.5,
      32.6
    ],
    [
      -113.6,
      32.6
    ],
    [
      -113.6,
      32.2
    ],
    [
      -113.7,
      32.2
    ],
    [
      -113.7,
      32.1
    ],
    [
      -113.9,
      32.1
    ],
    [
      -113.9,
      32.0
    ],
    [
      -114.1,
      32.0
    ],
    [
      -114.2,
      31.8
    ],
    [
      -114.4,
      31.8
    ],
    [
      -114.4,
      31.7
    ],
    [
      -115.2,
      31.7
    ],
    [
      -115.2,
      31.6
    ],
    [
      -116.4,
      31.6
    ],
    [
      -116.4,
      31.5
    ],
    [
      -117.2,
      31.5
    ],
    [
      -117.2,
      31.6
    ],
    [
      -117.4,
      31.6
    ],
    [
      -117.4,
      31.7
    ],
    [
      -117.6,
      31.7
    ],
    [
      -117.6,
      31.8
    ],
    [
      -117.8,
      31.8
    ],
    [
      -117.8,
      31.9
    ],
    [
      -118.0,
      32.0
    ],
    [
      -118.0,
      32.2
    ],
    [
      -118.2,
      32.3
    ],
    [
      -118.3,
      32.7
    ],
    [
      -118.4,
      32.7
    ],
    [
      -118.5,
      32.9
    ],
    [
      -118.8,
      32.9
    ],
    [
      -118.8,
      33.0
    ],
    [
      -119.1,
      33.0
    ],
    [
      -119.1,
      33.1
    ],
    [
      -119.4,
      33.1
    ],
    [
      -119.4,
      33.2
    ],
    [
      -119.7,
      33.2
    ],
    [
      -119.7,
      33.3
    ],
    [
      -120.0,
      33.3
    ],
    [
      -120.0,
      33.4
    ],
    [
      -120.3,
      33.4
    ],
    [
      -120.3,
      33.5
    ],
    [
      -120.6,
      33.5
    ],
    [
      -120.6,
      33.6
    ],
    [
      -120.9,
      33.6
    ],
    [
      -120.9,
      33.7
    ],
    [
      -121.1,
      33.7
    ],
    [
      -121.1,
      33.8
    ],
    [
      -121.2,
      33.8
    ],
    [
      -121.3,
      34.0
    ],
    [
      -121.4,
      34.0
    ],
    [
      -121.5,
      34.2
    ],
    [
      -121.6,
      34.2
    ],
    [
      -121.6,
      34.3
    ],
    [
      -121.8,
      34.4
    ],
    [
      -121.9,
      34.8
    ],
    [
      -122.1,
      34.9
    ],
    [
      -122.1,
      35.1
    ],
    [
      -122.3,
      35.2
    ],
    [
      -122.4,
      35.6
    ],
    [
      -122.6,
      35.7
    ],
    [
      -122.6,
      35.9
    ],
    [
      -122.8,
      36.0
    ],
    [
      -122.8,
      36.2
    ],
    [
      -123.0,
      36.3
    ],
    [
      -123.1,
      36.7
    ],
    [
      -123.3,
      36.8
    ],
    [
      -123.3,
      37.0
    ],
    [
      -123.5,
      37.1
    ],
    [
      -123.6,
      37.5
    ],
    [
      -123.8,
      37.6
    ],
    [
      -123.8,
      37.8
    ],
    [
      -124.0,
      37.9
    ],
    [
      -124.0,
      38.1
    ],
    [
      -124.2,
      38.2
    ],
    [
      -124.3,
      38.6
    ],
    [
      -124.5,
      38.7
    ],
    [
      -124.5,
      38.9
    ],
    [
      -124.7,
      39.0
    ],
    [
      -124.7,
      39.2
    ],
    [
      -124.9,
      39.3
    ],
    [
      -124.9,
      39.5
    ],
    [
      -125.0,
      39.5
    ],
    [
      -125.0,
      39.7
    ],
    [
      -125.2,
      39.8
    ],
    [
      -125.2,
      40.0
    ]
  ],
  "depth_min_km": 0.0,
  "depth_max_km": 30.0,
  "tectonic_setting": "transform",
  "cell_size_deg": 0.1,
  "target_min_magnitude": 3.95,
  "magnitude_bin_width": 0.1,
  "magnitude_max": 8.95,
  "mc": {
    "mc": 3.7,
    "method": "maximum_curvature",
    "b_value": 0.5904006040601665,
    "b_value_uncertainty": 0.009710726560536953,
    "n_events": 2358,
    "window_start": "1976-01-01T00:00:00Z",
    "window_end": "2026-08-01T00:00:00Z",
    "computed_at": "2026-09-03T10:34:21.309023Z",
    "correction": 0.2,
    "notes": "Wiemer & Wyss 2000 MAXC + 0.2 (Woessner & Wiemer 2005); b: Aki 1965 MLE"
  },
  "description": "Outer boundary of the pycsep RELM California region (union of the 7682 0.1-degree cells, simplified to 158 vertices with the area preserved). RELM conventions: M >= 3.95, depth <= 30 km.",
  "references": [
    "Schorlemmer & Gerstenberger 2007, SRL 78(1) (RELM testing region)",
    "Savran et al. 2022, SRL (pycsep; csep.core.regions.california_relm_region)"
  ]
}
